{
  "schema_version": "3.0",
  "device_id": "0198f000-0000-7000-8000-000000000002",
  "device_profile": "android_arm64_8gb_launch_v1",
  "display_name": "门口手机",
  "android_api": 35,
  "abi": "arm64-v8a",
  "memory_mb": 8192,
  "gms_available": true,
  "event_notifications_enabled": false,
  "app_version": "0.1.0",
  "revoked_at": null,
  "updated_at": "2026-08-02T00:00:00Z"
}
